<?xml version="1.0" encoding="UTF-8"?>
<tns:Task Id="1" xmlns:tns="http://www.example.org/PMOTask" xmlns:xsi="http://www.w3.org/2001/XMLSchema-instance" xsi:schemaLocation="http://www.example.org/PMOTask PMOTask.xsd ">
  <tns:Name>MyFirstTask</tns:Name>
  <tns:Description>KIKOU LOL</tns:Description>
  <tns:Metric tns:keyId="0">
    <tns:Description>estimate</tns:Description>
    <tns:estimate>
      <tns:wlSup>8</tns:wlSup>
      <tns:wlInf>5</tns:wlInf>
      <tns:startDate>2016-11-24</tns:startDate>
      <tns:endDate>2016-11-24</tns:endDate>
    </tns:estimate>
  </tns:Metric>
</tns:Task>
